{
  "resourceCanonicalId": "kubernetes+v1://tenant-a/cluster-1/core/Node/node-uid",
  "type": "metric",
  "timeRange": {
    "from": "2026-09-26T10:00:00Z",
    "to": "2026-09-26T10:01:00Z"
  },
  "queryTemplate": "node-nic-errors/v1",
  "budget": {
    "timeoutMs": 3000,
    "maxBytes": 1048576
  }
}
